,Rank,Key,ScoreNorm,Score
263,155,ISMP International Symposium Mathematical programming,0.020202020202020287,0.0009233610341643681
264,155,iStar,0.02020202020202014,0.0009233610341643614
265,155,Journal Computational Methods Sciences Engineering,0.02020202020202019,0.0009233610341643635
266,155,Journal of Applied Computing Research,0.02020202020202019,0.0009233610341643635
267,155,Journal of Computational and Applied Mathematics,0.020202020202020287,0.0009233610341643681
268,155,Journal of Optimization Theory and Applications,0.020202020202020287,0.0009233610341643681
269,155,Journal of Parallel and Distributed Computing (Print),0.02020202020202019,0.0009233610341643635
270,155,Journal of the American Society for Information Science and Technology (Print),0.02020202020202019,0.0009233610341643635
271,155,Journal of The Brazilian Computer Society (Online),0.020202020202020214,0.0009233610341643647
272,155,Journal of Theoretical Biology,0.02020202020202024,0.0009233610341643658
273,155,Journal of Universal Computer Science (Online),0.020202020202020214,0.0009233610341643647
274,155,Journal of Visual Languages and Computing,0.02020202020202014,0.0009233610341643614
275,155,Lagos Latin American Algorithms Graphs Optimization Symposium,0.02020202020202019,0.0009233610341643635
276,155,LAIO SBPO Congreso Latino Iberoamericano Investigacion Operativa Simposio Brasileiro Pesquisa Operacional,0.02020202020202019,0.0009233610341643635
277,155,Latin American Workshop Cliques Graphs LAWCG,0.020202020202020287,0.0009233610341643681
278,155,Latin Ibero American Conference Operations Research XLIVSBPO,0.020202020202020287,0.0009233610341643681
279,155,Lecture Notes in Computer Science,0.02020202020202024,0.0009233610341643658
280,155,Leveraging Applications Formal Methods Verification Validation ISoLA,0.02020202020202014,0.0009233610341643614
281,155,Microprocessors and Microsystems,0.020202020202020287,0.0009233610341643681
282,155,Nature (London),0.02020202020202019,0.0009233610341643635
283,155,NetSci,0.020202020202020287,0.0009233610341643681
284,155,Nonlinear Analysis,0.020202020202020287,0.0009233610341643681
285,155,Pattern Recognition,0.020202020202020287,0.0009233610341643681
286,155,"Physical Review. B, Condensed Matter and Materials Physics",0.020202020202020287,0.0009233610341643681
287,155,Proteomics Weinheim Print,0.020202020202020287,0.0009233610341643681
288,155,Revista Brasileira de Historia da Ciencia,0.020202020202020214,0.0009233610341643647
289,155,SAC Symposium Applied Computing,0.02020202020202014,0.0009233610341643614
290,155,SBAC PAD,0.02020202020202019,0.0009233610341643635
291,155,SBCCI,0.02020202020202019,0.0009233610341643635
292,155,SBGames Simposio Brasileiro Jogos Entretenimento Digital,0.02020202020202014,0.0009233610341643614
293,155,SBQS,0.02020202020202019,0.0009233610341643635
294,155,Science of Computer Programming (Print),0.020202020202020166,0.0009233610341643625
295,155,Scientiarum Historia,0.020202020202020287,0.0009233610341643681
296,155,Seminario Nacional Historia Ciencia Tecnologia Congresso Latino Americano Historia Ciencia Tecnologia,0.020202020202020287,0.0009233610341643681
297,155,SEMISH Seminario Integrado Software Hardware,0.020202020202020166,0.0009233610341643625
298,155,Sensors (Basel),0.02020202020202019,0.0009233610341643635
299,155,SHIALC Simposio Historia Informatica America Latina Caribe conjunto com Conferencia Latinoamericana Informatica,0.020202020202020287,0.0009233610341643681
300,155,SIAM Journal on Discrete Mathematics,0.020202020202020287,0.0009233610341643681
301,155,Simposio Brasileiro Banco Dados Sessao Demos,0.02020202020202019,0.0009233610341643635
302,155,"Simposio Brasileiro de Componentes, Arquiteturas e Reutilizacao de Software",0.02020202020202024,0.0009233610341643658
303,155,Simposio Brasileiro de Metodos Formais,0.02020202020202019,0.0009233610341643635
304,155,Simposio Brasileiro Fatores Humanos Sistemas Computacionais Conferencia Latino Americana Interacao Humano Computador,0.02020202020202019,0.0009233610341643635
305,155,Simposio Brasileiro Games Entretenimento DIgital SBGAMES,0.020202020202020287,0.0009233610341643681
306,155,Simposio Brasileiro Games Entretenimento Digital SBGames,0.02020202020202024,0.0009233610341643658
307,155,Simposio Brasileiro Informatica Educacao Workshop sobre Informatica Escola SBIE WIE,0.020202020202020287,0.0009233610341643681
308,155,Simposio Brasileiro Inteligencia Artificial SBIA,0.02020202020202014,0.0009233610341643614
309,155,Simposio Brasileiro Qualidade Software Concurso Teses Dissertacoes Qualidade Software,0.020202020202020287,0.0009233610341643681
310,155,Simposio Brasileiro Sistemas Informacao SBSI Cidades Inteligentes,0.020202020202020287,0.0009233610341643681
311,155,Simposio Brasileiro sobre Fatores Humanos Sistemas Computacao,0.02020202020202014,0.0009233610341643614
312,155,Simposio Brasileiros Componentes Arquiteturas Reutilizacao Software,0.020202020202020287,0.0009233610341643681
313,155,Simposio Pesquisa Operacional Logistica Marinha,0.02020202020202019,0.0009233610341643635
314,155,SMC IEEE International Conference Systems Man Cybernetics,0.020202020202020287,0.0009233610341643681
315,155,Software Engineering Education Training CSEE,0.020202020202020166,0.0009233610341643625
316,155,"Software, Practice & Experience (Print)",0.02020202020202014,0.0009233610341643614
317,155,STOPROGR International Workshop Stochastic Programming Implementation Advanced Applications,0.020202020202020287,0.0009233610341643681
318,155,TaPP Theory Practice Provenance,0.020202020202020287,0.0009233610341643681
319,155,The Visual Computer,0.020202020202020214,0.0009233610341643647
320,155,TOPI workshop Developing tools plug ins,0.02020202020202014,0.0009233610341643614
321,155,Transactions in GIS (Print),0.02020202020202019,0.0009233610341643635
322,155,Workshop Anual MPS WAMPS Sessao Ferramentas,0.020202020202020287,0.0009233610341643681
323,155,Workshop Applications Multi Many Core Architectures,0.020202020202020287,0.0009233610341643681
324,155,Workshop Brasileiro Visualizacao Software Congresso Brasileiro Software Teoria Pratica CBSoft,0.020202020202020287,0.0009233610341643681
325,155,Workshop de Computacao Aplicada a Gestao do Meio Ambiente e Recursos Naturais,0.02020202020202024,0.0009233610341643658
326,155,Workshop de Engenharia de Requisitos,0.02020202020202014,0.0009233610341643614
327,155,Workshop de Gerencia e Operacao de Redes e Servicos,0.02020202020202019,0.0009233610341643635
328,155,Workshop Developing Tools Plug ins TOPI,0.02020202020202014,0.0009233610341643614
329,155,Workshop Developing Tools Plugins TOPI,0.02020202020202014,0.0009233610341643614
330,155,Workshop Ferramentas Aplicacoes WFA Simposio Brasileiro Sistemas Multimidia Web WebMedia,0.020202020202020287,0.0009233610341643681
331,155,Workshop Manutencao Software Moderna WMSM,0.020202020202020287,0.0009233610341643681
332,155,Workshop Redes Dinamicas Sistemas P P,0.020202020202020287,0.0009233610341643681
333,155,Workshop Science Congresso Sociedade Brasileira Computacao,0.02020202020202019,0.0009233610341643635
334,155,Workshop Teses Dissertacoes Simposio Brasileiro Sistemas Multimidia Web WebMidia,0.02020202020202019,0.0009233610341643635
335,155,WORLDCOMP EEE International Conference Learning Business Enterprise Information Systems Government,0.020202020202020287,0.0009233610341643681
336,155,WWW Internet,0.020202020202020166,0.0009233610341643625
337,338,AAAI Fall Symposium Open Government Knowledge,0.01010101010101007,0.0004616805170821807
338,338,ACM Conference Embedded Networked Sensor Systems SenSys,0.010101010101010095,0.00046168051708218177
339,338,ACM Conference Information Knowledge Managament,0.010101010101010095,0.00046168051708218177
340,338,ACM Conference Recommender Systems,0.010101010101010095,0.00046168051708218177
341,338,ACM conference Recommender systems RECSYS,0.010101010101010144,0.00046168051708218405
342,338,ACM GECCO Genetic Evolutionary Computation Conference,0.010101010101010095,0.00046168051708218177
343,338,ACM GECCO Green Efficient Energy Applications GreenGEC Workshop,0.010101010101010095,0.00046168051708218177
344,338,ACM IEEE International Conference Model Driven Engineering Languages Systems MODELS,0.01010101010101007,0.0004616805170821807
345,338,ACM IEEE Joint Conference Digital Libraries JCDL,0.010101010101010095,0.00046168051708218177
346,338,ACM International Conference Information Knowledge Management,0.010101010101010095,0.00046168051708218177
347,338,ACM International Conference Multimedia,0.010101010101010095,0.00046168051708218177
348,338,ACM International Conference Multimedia Information Retrieval MIR,0.010101010101010095,0.00046168051708218177
349,338,ACM International Conference Ubiquitous Computing Workshop Social Interaction Spatially Separated Environments,0.01010101010101007,0.0004616805170821807
350,338,ACM International Conference Web Science,0.010101010101010095,0.00046168051708218177
351,338,ACM International Conference Web Search Data Mining WSDM,0.010101010101010095,0.00046168051708218177
352,338,ACM International Symposium Mobility Management Wireless Access,0.010101010101010095,0.00046168051708218177
353,338,"ACM International Symposium on Performance Evaluation of Wireless Ad Hoc, Sensor, and Ubiquitous Networks",0.010101010101010095,0.00046168051708218177
354,338,ACM International Workshop Hot Topics Planet Scale Measurement,0.010101010101010095,0.00046168051708218177
355,338,ACM International Workshop Performance Monitoring Measurement Evaluation Heterogeneous Wireless Wired Networks,0.010101010101010144,0.00046168051708218405
356,338,ACM Journal Data Information Quality,0.010101010101010095,0.00046168051708218177
357,338,ACM SAC MMV,0.01010101010101007,0.0004616805170821807
358,338,ACM SIGCOMM conference Internet measurement conference,0.010101010101010095,0.00046168051708218177
359,338,ACM SIGDOC,0.01010101010101007,0.0004616805170821807
360,338,ACM SIGGRAPH Conference Virtual Reality Continuum its Applications Industry,0.01010101010101007,0.0004616805170821807
361,338,ACM SIGIR Conference Demo Session,0.010101010101010095,0.00046168051708218177
362,338,ACM SIGKDD Conference on Knowledge Discovery and Data Mining,0.010101010101010095,0.00046168051708218177
363,338,ACM SIGKDD International Conference Knowledge Discovery Data Mining,0.010101010101010095,0.00046168051708218177
364,338,ACM SIGKDD International Conference Knowledge Discovery Data Mining KDD,0.010101010101010095,0.00046168051708218177
365,338,ACM SIGMETRICS,0.010101010101010144,0.00046168051708218405
366,338,ACM Sigmetrics,0.010101010101010144,0.00046168051708218405
367,338,ACM SIGMM International Conference Multimedia Information Retrieval,0.010101010101010095,0.00046168051708218177
368,338,ACM SIGMOD Workshop,0.010101010101010144,0.00046168051708218405
369,338,ACM SIGSPATIAL International Workshop Computational Transportation Science IWCTS,0.01010101010101007,0.0004616805170821807
370,338,ACM SIGSPATIAL International Workshop Location Based Social Networks,0.010101010101010095,0.00046168051708218177
371,338,ACM Sigspatial International Workshop Location based Social Networks,0.010101010101010095,0.00046168051708218177
372,338,ACM SIGSPATIAL International Workshop Location Based Social Networks LBSN,0.010101010101010095,0.00046168051708218177
373,338,ACM SPEC International Conference Performance Engineering ICPE,0.010101010101010144,0.00046168051708218405
374,338,ACM Symposium,0.010101010101010095,0.00046168051708218177
375,338,ACM Symposium Document Engeneering,0.01010101010101007,0.0004616805170821807
376,338,ACM Symposium Performance Evaluation Wireless Hoc Sensor Ubiquitous Networks,0.010101010101010095,0.00046168051708218177
377,338,ACM Transactions on Algorithms,0.01010101010101007,0.0004616805170821807
378,338,ACM USENIX Middleware Conference,0.01010101010101007,0.0004616805170821807
379,338,ACM Web Science Conference,0.010101010101010095,0.00046168051708218177
380,338,ACM WebSci,0.010101010101010144,0.00046168051708218405
381,338,ACM WebSci International COnference Web Science,0.010101010101010144,0.00046168051708218405
382,338,ACMIEEE international symposium empirical Software Engineering Measurement,0.010101010101010144,0.00046168051708218405
383,338,Advanced Materials Research,0.010101010101010144,0.00046168051708218405
384,338,Advanced Visual Interfaces AVI,0.01010101010101007,0.0004616805170821807
385,338,Agent Directed Simulation ADS Symposium Spring Simulation Multiconference,0.01010101010101007,0.0004616805170821807
386,338,Agent Directed Simulation Symposium ADS,0.01010101010101007,0.0004616805170821807
387,338,AGILE Conference on Geographic Information Science,0.010101010101010095,0.00046168051708218177
388,338,Alberto Mendelzon Int Workshop Foundations Data Management,0.010101010101010095,0.00046168051708218177
389,338,Alberto Mendelzon Workshop Foundations Data Management,0.010101010101010095,0.00046168051708218177
390,338,Algorithmica (New York. Internet),0.01010101010101007,0.0004616805170821807
391,338,Algorithms Computation St International Symposium ISAAC,0.01010101010101007,0.0004616805170821807
392,338,Algorithms Data Structures Symposium WADS formerly Workshop Algorithms Data Structures,0.01010101010101007,0.0004616805170821807
393,338,ALIO EURO Workshop Applied Combinatorial Optimization,0.010101010101010144,0.00046168051708218405
394,338,ALIO INFORMS,0.010101010101010144,0.00046168051708218405
395,338,Alio Informs joint international meeting,0.010101010101010144,0.00046168051708218405
396,338,AmI International Conference Ubiquitous Computing Ambient Intelligence,0.010101010101010144,0.00046168051708218405
397,338,Analog Integrated Circuits and Signal Processing,0.010101010101010144,0.00046168051708218405
398,338,Analysis in Theory and Applications,0.010101010101010144,0.00046168051708218405
399,338,Annales des Telecommunications,0.010101010101010095,0.00046168051708218177
400,338,Annales des Telecommunications Cessou,0.010101010101010095,0.00046168051708218177
401,338,Annual ACM Conference Research Development Information Retrieval,0.010101010101010095,0.00046168051708218177
402,338,Annual ACM Symposium Applied Computing,0.01010101010101007,0.0004616805170821807
403,338,Annual conference American Helicopter Society,0.01010101010101007,0.0004616805170821807
404,338,Annual Frontiers Education Conference FIE,0.010101010101010095,0.00046168051708218177
405,338,Annual International ACM SIGIR Conference on Research & Development in Information Retrieval,0.010101010101010095,0.00046168051708218177
406,338,annual international conference,0.01010101010101007,0.0004616805170821807
407,338,Annual Meeting Association Computational Linguistics,0.010101010101010095,0.00046168051708218177
408,338,AOSD,0.01010101010101007,0.0004616805170821807
409,338,AOSD Tenth international conference Aspect oriented software development,0.01010101010101007,0.0004616805170821807
410,338,Applied Mathematics and Computation,0.010101010101010144,0.00046168051708218405
411,338,Applied Statistics (Print),0.010101010101010095,0.00046168051708218177
412,338,APPOPT International Conference Approximation Optimization Caribbean,0.010101010101010144,0.00046168051708218405
413,338,APS March Meeting,0.010101010101010144,0.00046168051708218405
414,338,Arquivos de Neuro-Psiquiatria (Impresso),0.010101010101010095,0.00046168051708218177
415,338,Ars Combinatoria,0.010101010101010144,0.00046168051708218405
416,338,Asia Pacific Conference Computer Human Interaction,0.01010101010101007,0.0004616805170821807
417,338,ATMOS Workshop Algorithmic Approaches Transportation Modelling Optimization Systems,0.01010101010101007,0.0004616805170821807
418,338,AutoSoft Workshop Autonomous Software Systems CBSoft,0.01010101010101007,0.0004616805170821807
419,338,Bayesian analysis (Online),0.010101010101010095,0.00046168051708218177
420,338,Bio Inspired Solutions Wireless Sensor Networks Satellite Workshop Genetic Evolutionary Computation Conference,0.010101010101010095,0.00046168051708218177
421,338,Bioinformatics Oxford,0.010101010101010144,0.00046168051708218405
422,338,BIOMAT International Symposium Mathematical Computational Biology,0.010101010101010144,0.00046168051708218405
423,338,BMC Bioinformatics,0.010101010101010144,0.00046168051708218405
424,338,BMC Structural Biology (Online),0.010101010101010095,0.00046168051708218177
425,338,Boletim Ciencias Geodesicas,0.010101010101010095,0.00046168051708218177
426,338,Brasilian Conference Software Theory Practice,0.010101010101010144,0.00046168051708218405
427,338,Brazilian Conference Software Theory Practice CBSoft,0.010101010101010144,0.00046168051708218405
428,338,Brazilian Logic Conference,0.010101010101010144,0.00046168051708218405
429,338,Brazilian Robotics Symposium Latin American Robotics Symposium,0.010101010101010095,0.00046168051708218177
430,338,Brazilian Simposium Bioinformatics,0.010101010101010144,0.00046168051708218405
431,338,Brazilian Sympoisum Software Engineering,0.010101010101010144,0.00046168051708218405
432,338,Brazilian Symposium Computer Games Digital Entertainment SBGAmes,0.01010101010101007,0.0004616805170821807
433,338,Brazilian Symposium Computer Games Digital Entertainment SBGames,0.01010101010101007,0.0004616805170821807
434,338,Brazilian Symposium Computer Networks Distributed Systems Tools Session,0.01010101010101007,0.0004616805170821807
435,338,Brazilian Symposium Databases,0.010101010101010095,0.00046168051708218177
436,338,Brazilian Symposium Databases SBBD,0.010101010101010095,0.00046168051708218177
437,338,Brazilian Symposium Information Human Language Tecnhology,0.01010101010101007,0.0004616805170821807
438,338,Brazilian Symposium on Artificial Intelligence,0.01010101010101007,0.0004616805170821807
439,338,Brazilian Symposium Programming Language,0.010101010101010095,0.00046168051708218177
440,338,Brazilian Symposium Software Engineering,0.010101010101010095,0.00046168051708218177
441,338,Brazilian Symposyum Human Factors Computer Systems IHC,0.01010101010101007,0.0004616805170821807
442,338,Brazilian Workshop Game Theory Society BWGT,0.010101010101010144,0.00046168051708218405
443,338,Brazilian Workshop Social Network Analysis Mining,0.010101010101010095,0.00046168051708218177
444,338,Business & Information Systems Engineering,0.01010101010101007,0.0004616805170821807
445,338,CBSoft,0.010101010101010095,0.00046168051708218177
446,338,CBSoft Sessao Ferramentas,0.010101010101010095,0.00046168051708218177
447,338,CBSoft Sessao Ferramentas ACM SIGSoft Brazilian Symposium Software Engineering SBES,0.01010101010101007,0.0004616805170821807
448,338,CBSoft Simposio Brasileiro Engenharia Software,0.010101010101010095,0.00046168051708218177
449,338,Chip Cliffs Student Forum,0.010101010101010095,0.00046168051708218177
450,338,Chip Sampa Student Forum,0.010101010101010095,0.00046168051708218177
451,338,Chllenges Science Workshop CIS SBAC PAD,0.010101010101010144,0.00046168051708218405
452,338,Ciencia Hoje,0.010101010101010144,0.00046168051708218405
453,338,CIKM ACM Conference Information Knowledge Management,0.010101010101010095,0.00046168051708218177
454,338,Cladistics (Westport. Print),0.010101010101010095,0.00046168051708218177
455,338,CLEI Electronic Journal,0.010101010101010144,0.00046168051708218405
456,338,CLOUD,0.010101010101010144,0.00046168051708218405
457,338,Cloud Futures,0.01010101010101007,0.0004616805170821807
458,338,Cluster Computing,0.010101010101010095,0.00046168051708218177
459,338,CMA Workshop,0.01010101010101007,0.0004616805170821807
460,338,Collaboration Electronic messaging Anti Abuse Spam Conference CEAS,0.010101010101010095,0.00046168051708218177
461,338,Collaboration Technology International Conference CRIWG,0.01010101010101007,0.0004616805170821807
462,338,Cologne--Twente Workshop on graphs and combinatorial optimization,0.010101010101010144,0.00046168051708218405
463,338,Coloquio Matematica Regiao Norte,0.010101010101010144,0.00046168051708218405
464,338,Combinatorial Pattern Matching,0.01010101010101007,0.0004616805170821807
465,338,Communications of the ACM,0.01010101010101007,0.0004616805170821807
466,338,Computational Management Science (Print),0.010101010101010144,0.00046168051708218405
467,338,Computational Mathematical Methods Medicine Print,0.010101010101010095,0.00046168051708218177
468,338,Computational Optimization and Applications,0.010101010101010144,0.00046168051708218405
469,338,Computational Statistics & Data Analysis (Print),0.010101010101010095,0.00046168051708218177
470,338,Computational Statistics (Zeitschrift),0.010101010101010095,0.00046168051708218177
471,338,"Computer (Long Beach, Calif. Print)",0.01010101010101007,0.0004616805170821807
472,338,Computer Graphics Forum (Print),0.010101010101010144,0.00046168051708218405
473,338,"Computer Languages, Systems & Structures",0.01010101010101007,0.0004616805170821807
474,338,Computer Methods and Programs in Biomedicine (Print),0.010101010101010095,0.00046168051708218177
475,338,Computer Science Engineering,0.010101010101010144,0.00046168051708218405
476,338,Computer Supported Cooperative Work Design CSCWD International Conference,0.010101010101010144,0.00046168051708218405
477,338,Computers & Graphics,0.01010101010101007,0.0004616805170821807
478,338,Computers and Education,0.01010101010101007,0.0004616805170821807
479,338,Computers Entertainment CIE,0.01010101010101007,0.0004616805170821807
480,338,Computing Australasian Theory Symposium CATS,0.010101010101010144,0.00046168051708218405
481,338,Concurrency Computation Practice Experience,0.01010101010101007,0.0004616805170821807
482,338,Concurso Teses Dissertacoes Congresso Sociedade Brasileira Computacao,0.010101010101010095,0.00046168051708218177
483,338,Concurso Teses Dissertacoes CTD,0.010101010101010095,0.00046168051708218177
484,338,Concurso Teses Dissertacoes Inteligencia Artificial,0.010101010101010095,0.00046168051708218177
485,338,Concurso TEses Dissertacoes Qualidade Software SBQS,0.010101010101010144,0.00046168051708218405
486,338,Concurso Teses Dissertacoes Sociedadade Brasileira Computacao,0.010101010101010095,0.00046168051708218177
487,338,Concurso Trabalhos Iniciacao Cientifica SBC CTIC,0.010101010101010095,0.00046168051708218177
488,338,Conference Collaboration Technology CRIWG,0.010101010101010144,0.00046168051708218405
489,338,Conference Computer Supported Cooperative Work,0.01010101010101007,0.0004616805170821807
490,338,Conference Labs Evaluation Forum,0.010101010101010095,0.00046168051708218177
491,338,Conference on Human Factors in Computing Systems,0.010101010101010095,0.00046168051708218177
492,338,Conference on Software Engineering Education and Training,0.010101010101010144,0.00046168051708218405
493,338,Conference User Modeling Adaptation Personalization UMAP,0.01010101010101007,0.0004616805170821807
494,338,Conferencia ANPET Associacao Nacional Pesquisa Ensino Transporte,0.010101010101010095,0.00046168051708218177
495,338,Congresso Brasileiro Cartografia,0.010101010101010095,0.00046168051708218177
496,338,Congresso Brasileiro de Informatica em Saude,0.01010101010101007,0.0004616805170821807
497,338,Congresso Brasileiro Engenharia Biomedica,0.010101010101010144,0.00046168051708218405
498,338,Congresso Brasileiro Intelige ncia Computacional,0.010101010101010144,0.00046168051708218405
499,338,Congresso Brasileiro Pesquisas Cafeeiras,0.010101010101010095,0.00046168051708218177
500,338,Congresso Brasileiro Software Teoria Pratica CBSoft Sessao ferramentas,0.010101010101010144,0.00046168051708218405
501,338,Congresso Brasileiro Software Teoria Pratica CBSoft Workshop sobre Sistemas Software Autonomos AutoSoft Congresso Brasileiro Software Teoria Pratica CBSoft Workshop sobre Sistemas Software Autonomos AutoSoft,0.01010101010101007,0.0004616805170821807
502,338,Congresso Brasileiro Software Teoria Pratica Sessao Ferramentas,0.010101010101010095,0.00046168051708218177
503,338,Congresso Ibero Americano Engenharia Software CIbSE,0.01010101010101007,0.0004616805170821807
504,338,Congresso Iberoamericano,0.010101010101010144,0.00046168051708218405
505,338,Congresso Nacional de Matematica Aplicada e Computacional,0.010101010101010144,0.00046168051708218405
506,338,Congresso Nacional Engenharia Mecanica,0.010101010101010144,0.00046168051708218405
507,338,Congresso Pos graduacao Universidade Federal Lavras,0.010101010101010095,0.00046168051708218177
508,338,Congresso Sociedade Brasileira Computacao CSBC,0.010101010101010095,0.00046168051708218177
509,338,Congresso Sociedade Brasileira Computacao Science,0.010101010101010095,0.00046168051708218177
510,338,CRIWG,0.01010101010101007,0.0004616805170821807
511,338,CSCWD,0.010101010101010144,0.00046168051708218405
512,338,CTDQS Concurso Teses Dissertacoes Qualidade Software SBQS,0.010101010101010144,0.00046168051708218405
513,338,CTW,0.010101010101010144,0.00046168051708218405
514,338,DALI DEXA workshops,0.01010101010101007,0.0004616805170821807
515,338,Data & Knowledge Engineering,0.01010101010101007,0.0004616805170821807
516,338,Data Compression Conference DCC,0.01010101010101007,0.0004616805170821807
517,338,Demography Online,0.010101010101010095,0.00046168051708218177
518,338,Discrete Mathematics and Theoretical Computer Science (Online),0.010101010101010144,0.00046168051708218405
519,338,Discrete Optimization,0.010101010101010095,0.00046168051708218177
520,338,Disputatio (Lisboa),0.01010101010101007,0.0004616805170821807
521,338,Distributed and Parallel Databases,0.010101010101010144,0.00046168051708218405
522,338,DIVERS ACM RECSYS Workshop Novelty Diversity Recommender Systems,0.010101010101010095,0.00046168051708218177
