,Rank,Key,ScoreNorm,Score
523,338,Doctoral Symposium International Conference Software Reuse,0.010101010101010144,0.00046168051708218405
524,338,Ecological Applications,0.010101010101010095,0.00046168051708218177
525,338,EEE International Symposium Computer Architecture High Performance Computing,0.010101010101010095,0.00046168051708218177
526,338,ELAVIO Escuela Latinoamericana Verano Investigacion Operativa,0.010101010101010144,0.00046168051708218405
527,338,ELAVIO Escuela Latinoamericana Verano Investigacion Operativa Asociacion Latino Iberoamericana Investigacion Operativa,0.010101010101010144,0.00046168051708218405
528,338,Electronic Notes in Theoretical Computer Science,0.01010101010101007,0.0004616805170821807
529,338,Eleventh International Conference Autonomous Agents Multiagent Systems AAMAS,0.01010101010101007,0.0004616805170821807
530,338,Eleventh SIAM International Conference Data Mining,0.010101010101010095,0.00046168051708218177
531,338,EMBO Conference Series Catalytic mechanisms biological systems Catalytic mechanisms biological systems interface between chemistry biology,0.010101010101010095,0.00046168051708218177
532,338,Emerging Computational Methods Life Sciences ECMLS Workshop,0.010101010101010144,0.00046168051708218405
533,338,Encontro Linguistica Corpus ELC,0.01010101010101007,0.0004616805170821807
534,338,Encontro Nacional Estudos Populacionais,0.010101010101010095,0.00046168051708218177
535,338,Encontro Nacional Fisica Materia Condensada ENFMC,0.010101010101010095,0.00046168051708218177
536,338,Encontro Nacional Inteligencia Artificial,0.010101010101010095,0.00046168051708218177
537,338,Encontro nacional Inteligencia Artificial ENIA,0.010101010101010144,0.00046168051708218405
538,338,Encontro Nacional Inteligencia Artificial ENIA,0.010101010101010095,0.00046168051708218177
539,338,Energy Economics,0.010101010101010144,0.00046168051708218405
540,338,EngOpt International Conference Engineering,0.010101010101010144,0.00046168051708218405
541,338,ESAIM Control Optimization Calculus Variations,0.010101010101010144,0.00046168051708218405
542,338,eScience Workshop,0.010101010101010144,0.00046168051708218405
543,338,Escola Regional Informatica Minas Gerais,0.010101010101010095,0.00046168051708218177
544,338,Escola Regional Informatica Rio Janeiro,0.010101010101010144,0.00046168051708218405
545,338,Escola Regional Redes Computadores,0.010101010101010095,0.00046168051708218177
546,338,ESELAW Experimental Software Engineering Latin American Workshop,0.010101010101010144,0.00046168051708218405
547,338,ESEM International Symposium Empirical Software Engineering Measurement,0.010101010101010144,0.00046168051708218405
548,338,EUD International Symposium End User Development,0.01010101010101007,0.0004616805170821807
549,338,EURO,0.010101010101010144,0.00046168051708218405
550,338,Eurographics European Computer Graphics Conference Exhibition,0.01010101010101007,0.0004616805170821807
551,338,Euromicro Conference on Software Engineering and Advanced Applications,0.010101010101010144,0.00046168051708218405
552,338,Euromicro International Conference on Parallel Distributed and network--based Processing,0.010101010101010095,0.00046168051708218177
553,338,Euromicro International Conference Parallel Distributed Network Based Computing,0.010101010101010095,0.00046168051708218177
554,338,European Conference,0.010101010101010144,0.00046168051708218405
555,338,European Conference Machine Learning Principles Practices Knowledge Discovery Databases,0.010101010101010095,0.00046168051708218177
556,338,European Conference Machine Learning Principles Practices Knowledge Discovery Databases PKDD,0.010101010101010095,0.00046168051708218177
557,338,European Conference on Combinatorics Graph Theory and Applications,0.010101010101010144,0.00046168051708218405
558,338,European Conference Principles Practice Knowledge Production Computer Science,0.010101010101010095,0.00046168051708218177
559,338,European Journal of Scientific Research,0.010101010101010144,0.00046168051708218405
560,338,EUROPT Workshop European Working Group Continuous Optimization,0.010101010101010144,0.00046168051708218405
561,338,Experimental Software Engineering Latin American Workshop,0.010101010101010144,0.00046168051708218405
562,338,Extraction gestion connaissances EGC,0.010101010101010095,0.00046168051708218177
563,338,Extreme Conference Communication,0.010101010101010095,0.00046168051708218177
564,338,Extreme Conference Communication ExtremeCom,0.010101010101010095,0.00046168051708218177
565,338,First Monday (Online),0.010101010101010095,0.00046168051708218177
566,338,Fonte (Belo Horizonte),0.010101010101010095,0.00046168051708218177
567,338,FOSD Proceedings International Workshop Feature Oriented Software Development,0.01010101010101007,0.0004616805170821807
568,338,Fourteenth Conference Computational Natural Language Learning Shared Task CoNLL,0.01010101010101007,0.0004616805170821807
569,338,Fourteenth IEEE International EDOC Conference,0.010101010101010144,0.00046168051708218405
570,338,Functional Constraint Logic Programming,0.01010101010101007,0.0004616805170821807
571,338,Gastroenterologie Clinique Biologique,0.010101010101010095,0.00046168051708218177
572,338,GECCO Bio Inspired Solutions Wireless Sensor Networks Workshop,0.010101010101010095,0.00046168051708218177
573,338,Genetic and Evolutionary Computation Conference,0.010101010101010095,0.00046168051708218177
574,338,Genetic Evolutionary Computation Concerence GECCO,0.010101010101010095,0.00046168051708218177
575,338,Genetic Programming Evolvable Machines,0.010101010101010095,0.00046168051708218177
576,338,GESTS International Transactions on Computer Science and Engineering,0.010101010101010144,0.00046168051708218405
577,338,Globecom,0.010101010101010095,0.00046168051708218177
578,338,Graphical Models (Print),0.010101010101010144,0.00046168051708218405
579,338,Group Decision and Negotiation,0.010101010101010144,0.00046168051708218405
580,338,HAIS International Conference Hybrid Artificial Intelligence Systems,0.010101010101010144,0.00046168051708218405
581,338,HCI International Internationalization Design Global Development,0.01010101010101007,0.0004616805170821807
582,338,HCI International Universal Access Human Computer Interaction,0.01010101010101007,0.0004616805170821807
583,338,High Performance Computing Computational Science,0.010101010101010144,0.00046168051708218405
584,338,HPDC,0.010101010101010095,0.00046168051708218177
585,338,Hylo Hybrid Logic Workshop FLOCS,0.01010101010101007,0.0004616805170821807
586,338,IADIS International Conference on Applied Computing,0.010101010101010095,0.00046168051708218177
587,338,IADIS International Journal on WWWInternet,0.010101010101010144,0.00046168051708218405
588,338,IADIS Telecommunications Networks Systems TNS,0.010101010101010095,0.00046168051708218177
589,338,IADIS WWW Internet Conference,0.010101010101010095,0.00046168051708218177
590,338,Ibero American Conference Software Engineering CIbSE,0.010101010101010144,0.00046168051708218405
591,338,Iberoamerican Conference Software Engineering CIbSE,0.010101010101010144,0.00046168051708218405
592,338,Iberoamerican Congress on Pattern Recognition,0.010101010101010095,0.00046168051708218177
593,338,ICALP,0.01010101010101007,0.0004616805170821807
594,338,ICCCN Workshop Multimedia Computing Communications,0.01010101010101007,0.0004616805170821807
595,338,ICIN International Conference Intelligence Next Generation Networks Weaving Applications into Network Fabric,0.010101010101010095,0.00046168051708218177
596,338,ICITA International Conference Information Technology Application,0.010101010101010095,0.00046168051708218177
597,338,iConference,0.010101010101010095,0.00046168051708218177
598,338,ICOR,0.010101010101010144,0.00046168051708218405
599,338,ICOR International Conference Operations Research,0.010101010101010144,0.00046168051708218405
600,338,ICSE Workshop Flexible Modeling Tools,0.01010101010101007,0.0004616805170821807
601,338,ICSP International Conference Software Process,0.010101010101010095,0.00046168051708218177
602,338,IEEE ACM Symposium Distributed Simulation Real Time Applications,0.010101010101010095,0.00046168051708218177
603,338,IEEE Annual Computer Software Applications Conference COMPSAC,0.01010101010101007,0.0004616805170821807
604,338,IEEE Communications Letters (Print),0.010101010101010095,0.00046168051708218177
605,338,IEEE Communications Magazine (Print),0.01010101010101007,0.0004616805170821807
606,338,IEEE Conference Computational Intelligence Games CIG,0.010101010101010095,0.00046168051708218177
607,338,IEEE Congree Evolutionary Computation,0.010101010101010095,0.00046168051708218177
608,338,IEEE ECBS,0.01010101010101007,0.0004616805170821807
609,338,IEEE Frontiers Education Conference FIE,0.010101010101010095,0.00046168051708218177
610,338,IEEE Global Telecommunications Conference,0.010101010101010095,0.00046168051708218177
611,338,IEEE Globecom,0.010101010101010144,0.00046168051708218405
612,338,IEEE IACSIT International Conference Mechanical Engineer Robotics Aeroespace ICEMERA,0.010101010101010144,0.00046168051708218405
613,338,IEEE IFIP International Symposium Integrated Network Management,0.010101010101010095,0.00046168051708218177
614,338,IEEE Infocom,0.010101010101010095,0.00046168051708218177
615,338,IEEE Information Theory Workshop,0.010101010101010144,0.00046168051708218405
616,338,IEEE International Conference Cloud Computing Cloud,0.01010101010101007,0.0004616805170821807
617,338,IEEE International Conference Digital Ecosystems Technologies DEST Complex Environment Engineering,0.010101010101010144,0.00046168051708218405
618,338,IEEE International Conference eScience,0.010101010101010144,0.00046168051708218405
619,338,IEEE International Conference EScience eScience,0.010101010101010144,0.00046168051708218405
620,338,IEEE International Conference Global Software Engineering ICGSE,0.010101010101010144,0.00046168051708218405
621,338,IEEE International Conference Information Reuse Integration IRI,0.010101010101010144,0.00046168051708218405
622,338,IEEE International Conference Multimedia Expo ICME,0.01010101010101007,0.0004616805170821807
623,338,IEEE International Conference on Engineering of Complex Computer Systems,0.01010101010101007,0.0004616805170821807
624,338,IEEE International Conference on Image Processing,0.010101010101010095,0.00046168051708218177
625,338,IEEE International Conference on Multimedia and Expo,0.010101010101010095,0.00046168051708218177
626,338,IEEE International Conference on Systems Man and Cybernetics,0.010101010101010095,0.00046168051708218177
627,338,IEEE International Conference on Tools with Artificial Intelligence,0.010101010101010095,0.00046168051708218177
628,338,IEEE International Conference Self Adaptive Self Organizing Systems SASO,0.01010101010101007,0.0004616805170821807
629,338,IEEE International Conference Semantic Computing ICSC,0.01010101010101007,0.0004616805170821807
630,338,IEEE International Conference Semantic Computing IEEE ICSC,0.01010101010101007,0.0004616805170821807
631,338,IEEE International Conference Software Maintenance ICSM,0.01010101010101007,0.0004616805170821807
632,338,IEEE International Conference Software Testing Verification Validation Workshops ICSTW,0.010101010101010144,0.00046168051708218405
633,338,IEEE International Conference Systems Man Cybernetics SMC,0.010101010101010095,0.00046168051708218177
634,338,IEEE International Geoscience and Remote Sensing Symposium,0.010101010101010095,0.00046168051708218177
635,338,IEEE International Requirements Engineering Conference,0.01010101010101007,0.0004616805170821807
636,338,IEEE International Symposium Computer Architecture High Performance Computing,0.010101010101010095,0.00046168051708218177
637,338,IEEE International Symposium Computer Architecture High Performance Computing SBAC PAD,0.010101010101010095,0.00046168051708218177
638,338,IEEE International Symposium Modeling Analysis Simulation Computer Telecommunication Systems MASCOTS,0.010101010101010144,0.00046168051708218405
639,338,IEEE International Symposium on Circuits and Systems,0.010101010101010144,0.00046168051708218405
640,338,IEEE International Symposium Parallel Distributed Processing with Applications,0.010101010101010095,0.00046168051708218177
641,338,IEEE International Symposium Service Oriented System Engineering SOSE,0.01010101010101007,0.0004616805170821807
642,338,IEEE International Symposium Social Intelligence Networking SIN,0.010101010101010095,0.00046168051708218177
643,338,IEEE International Symposium Software Reliability Engineering ISSRE,0.01010101010101007,0.0004616805170821807
644,338,IEEE International Symposium World Wireless Mobile Multimedia Networks WoWMoM,0.010101010101010144,0.00046168051708218405
645,338,IEEE International Workshop Selected Topics Wireless Mobile Computing,0.010101010101010095,0.00046168051708218177
646,338,IEEE Joint Conference Digital Libraries,0.010101010101010095,0.00046168051708218177
647,338,IEEE Joint VORTE MOST Workshop,0.010101010101010144,0.00046168051708218405
648,338,IEEE Journal on Selected Areas in Communications (Print),0.010101010101010095,0.00046168051708218177
649,338,IEEE Latin American Regional Conference Engineering Computer Based Systems,0.01010101010101007,0.0004616805170821807
650,338,IEEE Latin American Robotics Symposium,0.010101010101010095,0.00046168051708218177
651,338,IEEE Latin American Symposium Circuits Systems,0.010101010101010144,0.00046168051708218405
652,338,IEEE Network,0.010101010101010095,0.00046168051708218177
653,338,IEEE Pervasive Computing Communication PerCom,0.010101010101010095,0.00046168051708218177
654,338,IEEE PIMRC,0.010101010101010095,0.00046168051708218177
655,338,IEEE RSJ International Conference Intelligent Robots Systems,0.010101010101010095,0.00046168051708218177
656,338,IEEE Scientific Workflow Workshop,0.010101010101010144,0.00046168051708218405
657,338,IEEE Sensors Journal,0.010101010101010095,0.00046168051708218177
658,338,IEEE Symposium Biological Data,0.010101010101010095,0.00046168051708218177
659,338,IEEE Symposium Biological Data Visualization,0.010101010101010095,0.00046168051708218177
660,338,IEEE Symposium Computers Communications ISCC,0.010101010101010095,0.00046168051708218177
661,338,IEEE Symposium Visual Languages Human Centric Computing HCC,0.01010101010101007,0.0004616805170821807
662,338,IEEE Transactions on Biomedical Engineering (Print),0.010101010101010144,0.00046168051708218405
663,338,IEEE Transactions on Knowledge and Data Engineering (Print),0.010101010101010095,0.00046168051708218177
664,338,IEEE Transactions on Visualization and Computer Graphics,0.010101010101010144,0.00046168051708218405
665,338,IEEE TrustCom IEEE ICESS FCST,0.010101010101010095,0.00046168051708218177
666,338,IEEE Visual Analytics Science Technology,0.010101010101010095,0.00046168051708218177
667,338,IEEE WCNC,0.010101010101010095,0.00046168051708218177
668,338,IEEE Wireless and Communications and Networking Conference,0.010101010101010095,0.00046168051708218177
669,338,IEEE Wireless Communications,0.010101010101010095,0.00046168051708218177
670,338,IEEE WORKSHOP COMPUTATIONAL INTELLIGENCE PRODUCTION LOGISTICS SYSTEMS,0.010101010101010095,0.00046168051708218177
671,338,IEEE Workshop Many Task Computing Grids Supercomputers MTAGS,0.010101010101010144,0.00046168051708218405
672,338,IEEE Workshop on Applications of Computer Vision,0.010101010101010095,0.00046168051708218177
673,338,IEEE Workshop Pervasive Collaboration Social Networking PerCol,0.01010101010101007,0.0004616805170821807
674,338,IEEE World Congress Computacional Intelligence,0.010101010101010144,0.00046168051708218405
675,338,IEEE/IFIP Network Operations and Management Symposium,0.010101010101010095,0.00046168051708218177
676,338,IEEE/RJS International Conference on Intelligent Robots and Systems,0.010101010101010095,0.00046168051708218177
677,338,IFIP ACM Latin America Networking Conference,0.010101010101010095,0.00046168051708218177
678,338,IFIP HCIS,0.01010101010101007,0.0004616805170821807
679,338,IFIP IEEE International Symposium Integrated Network Management Dissertation Digest,0.010101010101010095,0.00046168051708218177
680,338,IFIP International Conference New Technologies Mobility Security NTMS,0.010101010101010095,0.00046168051708218177
681,338,IFIP International Conference on Testing Software and Systems,0.010101010101010144,0.00046168051708218405
682,338,IFIP Networking,0.010101010101010095,0.00046168051708218177
683,338,IFIP TC Conference Human Computer Interaction,0.010101010101010095,0.00046168051708218177
684,338,IFIP TC Conference Human Computer Interaction INTERACT,0.010101010101010095,0.00046168051708218177
685,338,IFIP Wireless Days,0.010101010101010095,0.00046168051708218177
686,338,IFIP Wireless Days Conference,0.010101010101010095,0.00046168051708218177
687,338,IFIP/IEEE International Symposium on Integrated Network Management,0.010101010101010095,0.00046168051708218177
688,338,IFORS,0.010101010101010144,0.00046168051708218405
689,338,IHC CLIHC Simposio Brasileiro Fatores Humanos Sistemas Computacionais conferencia Latinoamericana Interacao Humano Computador,0.01010101010101007,0.0004616805170821807
690,338,IISoLA International Symposium Leveraging Applications Formal Methods,0.01010101010101007,0.0004616805170821807
691,338,Improved Algorithms Volume Rendering Mesh Processing,0.010101010101010144,0.00046168051708218405
692,338,INFOCOM,0.010101010101010095,0.00046168051708218177
693,338,INFOCOMP (UFLA. Impresso),0.010101010101010144,0.00046168051708218405
694,338,Informatica diritto,0.01010101010101007,0.0004616805170821807
695,338,Information Retrieval,0.010101010101010095,0.00046168051708218177
696,338,Information Retrieval (Boston),0.010101010101010095,0.00046168051708218177
697,338,Informatique Theorique et Applications (Imprime),0.010101010101010144,0.00046168051708218405
698,338,Informs Annual Meeting,0.010101010101010144,0.00046168051708218405
699,338,Int Conf Control Automation Robotics Vision,0.010101010101010144,0.00046168051708218405
700,338,Int Conf Data Management Grid Peer Peer Systems Globe,0.010101010101010144,0.00046168051708218405
701,338,Int Conf Entertainment Computing ICEC,0.01010101010101007,0.0004616805170821807
702,338,Int Conf Interactive Digital Storytelling ICIDS,0.01010101010101007,0.0004616805170821807
703,338,Int Conference Systems Signals Image Processing IWSSIP,0.01010101010101007,0.0004616805170821807
704,338,"Interactions (New York, N.Y.)",0.01010101010101007,0.0004616805170821807
705,338,International ACM Conference Management Emergent Digital EcoSystems MEDES,0.010101010101010095,0.00046168051708218177
706,338,International ACM Conference Web Science,0.010101010101010095,0.00046168051708218177
707,338,international ACM SIGIR conference,0.010101010101010095,0.00046168051708218177
708,338,INTERNATIONAL BIENNALE COMMERCIAL NEGOTIATION,0.010101010101010144,0.00046168051708218405
709,338,International Confeence Software Engineering Knowledge Engineering SEKE,0.010101010101010144,0.00046168051708218405
710,338,International Conference Advances Human oriented Personalized Mechanisms Technologies Services,0.010101010101010095,0.00046168051708218177
711,338,International Conference Algorithms Architectures Parallel Processing ICA PP,0.010101010101010144,0.00046168051708218405
712,338,International Conference Ambient Systems Networks Technologies,0.010101010101010095,0.00046168051708218177
713,338,International Conference Autonomic Autonomous Systemps,0.010101010101010144,0.00046168051708218405
714,338,International Conference Autonomous Agents Multiagent Systems,0.01010101010101007,0.0004616805170821807
715,338,International Conference Autonomous Agents Multiagent Systems AAMAS,0.01010101010101007,0.0004616805170821807
716,338,International Conference BPMDS,0.01010101010101007,0.0004616805170821807
717,338,International Conference Chilean Computer Science Society SCCC,0.010101010101010144,0.00046168051708218405
718,338,International Conference Communication Systems Networks,0.010101010101010144,0.00046168051708218405
719,338,International Conference Communication Systems Networks COMSNETS,0.010101010101010144,0.00046168051708218405
720,338,International Conference Communications,0.010101010101010095,0.00046168051708218177
721,338,International Conference Compiler Construction European Joint Conferences Theory Practice Software ETAPS,0.010101010101010095,0.00046168051708218177
722,338,International Conference Computational Processing Portuguese Language,0.01010101010101007,0.0004616805170821807
723,338,International Conference Computational Processing Portuguese Language PROPOR,0.01010101010101007,0.0004616805170821807
724,338,International Conference Computational Science Its Applications ICCSA,0.010101010101010095,0.00046168051708218177
725,338,International Conference Computer Communications Networks ICCCN,0.010101010101010144,0.00046168051708218405
726,338,International Conference Computer Games,0.010101010101010095,0.00046168051708218177
727,338,International Conference Computer Science Engineering Applications ICCSEA,0.01010101010101007,0.0004616805170821807
728,338,International Conference Engineering Technology Education,0.010101010101010144,0.00046168051708218405
729,338,International Conference Enterprise Information Systems ICEIS Revised Best Papers,0.010101010101010144,0.00046168051708218405
730,338,International Conference Entertainment Computing,0.01010101010101007,0.0004616805170821807
731,338,International Conference Entertainment Computing ICEC,0.01010101010101007,0.0004616805170821807
732,338,International Conference Evolutionary Computation Theory Applications,0.010101010101010144,0.00046168051708218405
733,338,International Conference Finite Elements Flow Problems,0.010101010101010144,0.00046168051708218405
734,338,International Conference Genetic Evolutionary Computation Conference Companion,0.010101010101010095,0.00046168051708218177
735,338,International Conference Geographic Object Based Image Analysis,0.010101010101010144,0.00046168051708218405
736,338,International Conference HCD Held Part HCI International,0.01010101010101007,0.0004616805170821807
737,338,International Conference High Performance Computing Communications,0.010101010101010144,0.00046168051708218405
738,338,International Conference High Performance Computing Systems HPCS,0.010101010101010095,0.00046168051708218177
739,338,International Conference Information Integration Web based Applications Services iiWAS,0.01010101010101007,0.0004616805170821807
740,338,International Conference Information Society,0.010101010101010095,0.00046168051708218177
741,338,International Conference Information Society Society,0.010101010101010144,0.00046168051708218405
742,338,International Conference Information Systems ICIS,0.010101010101010144,0.00046168051708218405
743,338,International Conference Intelligent Text Processing Computational Linguistics,0.01010101010101007,0.0004616805170821807
744,338,International Conference Knowledge Based Intelligent Information Engineering Systems KES,0.01010101010101007,0.0004616805170821807
745,338,International Conference Knowledge Discovery Data Mining Eighth Workshop Mining Learning with Graphs,0.010101010101010095,0.00046168051708218177
746,338,International Conference Knowledge Discovery Information Extraction KDIR,0.01010101010101007,0.0004616805170821807
747,338,International Conference Management Data,0.010101010101010095,0.00046168051708218177
748,338,International Conference Management Emergent Digital EcoSystems,0.010101010101010144,0.00046168051708218405
749,338,International Conference Mobile Data Management MDM,0.01010101010101007,0.0004616805170821807
750,338,International Conference Model Driven Engineering Languages Systems ACM IEEE,0.01010101010101007,0.0004616805170821807
751,338,International Conference Neural Computation,0.010101010101010144,0.00046168051708218405
752,338,International Conference NEW AN Conference Smart Spaces ruSMART,0.010101010101010144,0.00046168051708218405
753,338,International Conference on 3D Web Technology,0.01010101010101007,0.0004616805170821807
754,338,International Conference on Advances in Mesh Networks,0.010101010101010095,0.00046168051708218177
755,338,International Conference on Compiler Construction,0.010101010101010095,0.00046168051708218177
756,338,International Conference on Computational Science and its Applications,0.010101010101010095,0.00046168051708218177
757,338,International Conference on Computer Communications and Networks,0.010101010101010095,0.00046168051708218177
758,338,International Conference on Computer Vision Theory and Applications,0.01010101010101007,0.0004616805170821807
759,338,International Conference on Human--Computer Interaction,0.01010101010101007,0.0004616805170821807
760,338,International Conference on Information and Knowledge Management,0.010101010101010095,0.00046168051708218177
761,338,International Conference on Intelligent Environments,0.010101010101010144,0.00046168051708218405
762,338,International Conference on on Software and Systems Process,0.010101010101010144,0.00046168051708218405
763,338,International Conference on Ontologies Databases and Applications of Semantics,0.01010101010101007,0.0004616805170821807
764,338,International Conference on Simulated Evolution and Learning,0.010101010101010095,0.00046168051708218177
765,338,International Conference on Stochastic Programming,0.010101010101010144,0.00046168051708218405
766,338,International Conference Parallel Architectures Compilation Techniques PACT,0.010101010101010095,0.00046168051708218177
